<?xml version="1.0"?>

<config xmlns:xsi="http://www.w3.org/2001/XMLSchema-instance" xsi:noNamespaceSchemaLocation="urn:amasty:module:Amasty_ReportBuilder:etc/entity_scheme.xsd">
    <amasty_report_builder_entities>
        <entity name="customer_address" eav="true">
            <title>Customer Address</title>
            <main_table>customer_address_entity</main_table>

            <columns>
                <column name="entity_id" primary="true" />
                <column name="region_id">
                    <source_model>Magento\Directory\Model\Config\Source\Allregion</source_model>
                </column>
                <column name="country_id">
                    <source_model>Magento\Directory\Model\Config\Source\Country</source_model>
                </column>
                <column name="is_active">
                    <source_model>Magento\Config\Model\Config\Source\Yesno</source_model>
                </column>
            </columns>

            <relations>
                <relation name="customer" type="column">
                    <column>parent_id</column>
                    <reference_column>entity_id</reference_column>
                    <relationship_type>one_to_one</relationship_type>
                </relation>
                <relation name="order_address" type="column">
                    <column>entity_id</column>
                    <reference_column>customer_address_id</reference_column>
                    <relationship_type>one_to_many</relationship_type>
                </relation>
            </relations>
        </entity>
    </amasty_report_builder_entities>
</config>
